,Agenda,Bulan,Tahun,Kriteria,No SPP,"Tanggal
SPP",Tanggal Masuk, Kontrol ,Dibayarkan Kepada,Uraian SPP,"Nilai
(Rp)",Tanggal Paraf,Pemaraf,Tgl selesai diproses,Tgl Kembali Ke Bagian,Tgl Hasil Koreksi Bagian, Kepala Sub Bagian , KETERANGAN , Status Dokumen , ke Keuangan , Gabungan , Tanggal Bayar , Bagian , LINK , No SPK , Tanggal SPK , Tgl. Akhir SPK , No Berita Acara (BA) , Tanggal Berita Acara (BA) , No. PO , No. Miro/SES , Status Perpajakan , No Faktur , Tanggal Faktur , Tgl. Selesai verifikasi Pajak , Jenis PPh ,DPP PPh,PPh Terhutang
,0001,a. Januari,2026,,5SKH/SPP/01/I/2026,02/01/2026,02/01/2026 9:38:35,1,Fauzan Chairil A,Penggantian biaya Konsumsi Senam sesuai Nota Terlampir,620.000,02/01/2026 9:46:20,Yuni,02/01/2026 9:47:06,,,02/01/2026 9:47:06,,Selesai Verifikasi,,0001_2026,,Sekretariat & Hukum,,,,,,,,,,,,,,,
,0002,a. Januari,2026,50. CAPEX PUPUK,5TAN/SPP/1534/XII/2025,31/12/2025,02/01/2026 10:17:38,1,PT Weha Agro Sejahtera,Permintaan pembayaran Pekerjaan Pupuk Urea Nitrea Kebun Sungai Dekan sesuai Surat Perjanjian No. 5TAN/SPJ/45/VII/2024 tgl. 16 September 2024,3.499.406.062,,,,07/01/2026 8:59:16,,,"BAST, dok MIR 7, PR belum ada",Dikembalikan,,0002_2026,,Tanaman,,,,,,,,,,,,,,,
,0003,a. Januari,2026,,5SDM/SPP/1780/XII/2025,31/12/2025,02/01/2026 10:28:39,1,Kebun-PKS Longkali,Pembayaran Extra Fooding Kebun-PKS Longkali bulan Desember 2025,1.554.000,02/01/2026 14:46:36,Yuni,02/01/2026 14:48:22,,,06/01/2026 16:40:55,,Selesai Dibayar,,0003_2026,14/01/2026,SDM & Sistem Manajemen,,,,,,,,,,,,,,,
,0004,a. Januari,2026,50. Pembelian TBS KALSEL,5DPM/5AKN/SPP/4/I/2026,02/01/2026,02/01/2026 10:47:55,1,Pemasok TBS di PKS Pelaihari,Permintaan pembayaran TBS Pemasok di PKS Pelaihari periode tgl. 31 Desember 2025,160.718.995,02/01/2026 14:32:35,Yuni,02/01/2026 14:32:27,,,02/01/2026 16:32:27,,Selesai Dibayar,,0004_2026,02/01/2026,SDM & Sistem Manajemen,,,,,,,,,,,,,,,
,0005,a. Januari,2026,50. Pembelian TBS KALBAR & P3BB,5DPM/5AKN/SPP/2/I/2026,02/01/2026,02/01/2026 10:49:04,1,Pemasok TBS di PKS Ngabang,Permintaan pembayaran Pembelian TBS Pekebun Swadaya/Pihak III PKS Ngabang periode tgl. 31 Desember 2025,160.867.822,02/01/2026 14:32:42,Yuni,02/01/2026 14:32:55,,,02/01/2026 16:32:27,,Selesai Dibayar,,0005_2026,02/01/2026,SDM & Sistem Manajemen,,,,,,,,,,,,,,,
,0006,a. Januari,2026,50. Pembelian TBS KALTIM,5DPM/5AKN/SPP/3/I/2026,02/01/2026,02/01/2026 10:51:08,1,Pemasok di PKS Long Pinang,Permintaan pembayaran TBS di PKS Long Pinang periode tgl. 31 Desember 2025,285.516.420,02/01/2026 14:32:45,Yuni,02/01/2026 14:32:58,,,02/01/2026 16:32:27,,Selesai Dibayar,,0006_2026,02/01/2026,SDM & Sistem Manajemen,,,,,,,,,,,,,,,
,0007,a. Januari,2026,50. Pembelian TBS KALBAR & P3BB,5DPM/5AKN/SPP/1/I/2026,02/01/2026,02/01/2026 11:34:03,1,Pemasok TBS di PKS Gunung Meliau,Permintaan pembayaran Pembelian TBS Plasma/Pekebun Swadaya P.III PKS Gunung Meliau periode tgl. 31 Desember 2025,151.182.894,02/01/2026 14:33:22,Yuni,02/01/2026 14:33:26,,,02/01/2026 16:32:27,,Selesai Dibayar,,0007_2026,02/01/2026,SDM & Sistem Manajemen,,,,,,,,,,,,,,,
,0008,a. Januari,2026,50. BARANG DAN JASA KEBUN UNIT,5TEP/SPP/01/I/2026,02/01/2026,02/01/2026 11:38:21,1,CV Zamzami Sejahtera,Permintaan atas Pembelian Barang dan Jasa sesuai OPL/SPK/SPJB No. 5TEP/15/52/OPL/2025 tgl. 15 Desember 2025,36.907.500,02/01/2026 14:55:50,Yuni,02/01/2026 14:55:54,,,07/01/2026 10:17:39,,Selesai Dibayar,,0008_2026,07/01/2026,Teknik dan Pengolahan,,,,,,,4100301753,,,,,,,,
,0009,a. Januari,2026,50. BARANG DAN JASA KEBUN UNIT,5TEP/SPP/02/I/2026,02/01/2026,02/01/2026 11:41:21,1,CV Ratu Mekar Widjaya,Permintaan atas Pembelian Barang dan Jasa sesuai OPL/SPK/SPJB,116.272.500,02/01/2026 14:56:03,Yuni,02/01/2026 14:56:08,,,13/01/2026 9:37:43,,Selesai Dibayar,,0009_2026,14/01/2026,Teknik dan Pengolahan,,,,,,,"4100300003, 4300069083, 4300069083",,,,,,,,
,0010,a. Januari,2026,,5TEP/SPP/1097/XII/2025,29/12/2025,02/01/2026 14:13:21,1,CV Sumber Artha Lestari,Permintaan rampung atas Jasa Antar Jemput Anak Sekolah Kebun Pelaihari Kalimantan Selatan sesuai No. SPK Kontrak 5KPL/X/SP/239/XI/2025,12.208.000,05/01/2026 8:52:27,Yuni,05/01/2026 8:52:32,,,06/01/2026 10:16:59,,Selesai Dibayar,,0010_2026,07/01/2026,Teknik dan Pengolahan,,,,,,,4704046833,,,,,,,,
,0011,a. Januari,2026,,5TEP/SPP/1096/XII/2025,29/12/2025,02/01/2026 14:16:19,1,CV Royal Harfabet,Permintaan rampung atas Pembuatan 4 unit Box Culvert Afd. IV Kebun Longkali Kalimantan Timur sesuai No. SPK Kontrak 5TEP-AB/SP/199/XI/2025,229.944.526,05/01/2026 14:59:05,Yuni,05/01/2026 14:59:00,,,06/01/2026 16:41:39,,Selesai Dibayar,,0011_2026,14/01/2026,Teknik dan Pengolahan,,,,,,,4300080215,,,,,,,,
,0012,a. Januari,2026,50. Sewa Alat Berat,5TEP/SPP/1095/XII/2025,29/12/2025,02/01/2026 14:19:31,1,PT Lin Citra Wahana,"Permintaan rampung atas Sewa 280 HM Road Greader dan 225 HM Vibro Roller untuk Pekerjaan Perbaikan Jalan Penghubung, Produksi, dan Koleksi di Afdeling V Kebun Tabara Kalimantan Timur sesuai No. SPK Kontrak 5TEP-AB/SP/191/XI/2025",395.179.537,05/01/2026 14:58:52,Yuni,05/01/2026 14:58:57,,,06/01/2026 16:40:48,,Selesai Dibayar,,0012_2026,14/01/2026,Teknik dan Pengolahan,,,,,,,4300079740,,,,,,,,
,0013,a. Januari,2026,,5TEP/SPP/1094/XII/2025,29/12/2025,02/01/2026 14:26:49,1,CV Mega Berkah Utama,Permintaan rampung atas Pemasangan Jaringan Air (PDAM) di Afdeling I Kebun Tajati Kalimantan Timur sesuai No. SPK Kontrak 5TEP-AB/SP/174/X/2025,300.551.499,05/01/2026 14:54:26,Yuni,05/01/2026 14:54:31,,,06/01/2026 14:36:32,,Selesai Dibayar,,0013_2026,14/01/2026,Teknik dan Pengolahan,,,,,,,43000081491,,,,,,,,
,0014,a. Januari,2026,50. Sewa Alat Berat,5TEP/SPP/1088/XII/2025,29/12/2025,02/01/2026 14:54:35,1,PT Lin Citra Wahana,Permintaan rampung atas Sewa 400 HM Excavator PC 135 untuk Pekerjaan Perbaikan Jalan Penghubung dan Koleksi dengan Cuci Parit Drainase di Afdeling I Kebun Pandawa Kalimantan Timur sesuai No. SPK Kontrak 5TEP-AB/SP/109/VII/2025,320.022.560,05/01/2026 14:48:09,Yuni,05/01/2026 14:48:22,,,06/01/2026 16:40:01,,Selesai Dibayar,,0014_2026,14/01/2026,Teknik dan Pengolahan,,,,,,,4300073868,,,,,,,,
,0015,a. Januari,2026,50. ANGKUTAN TBS DAN KARET,5TEP/SPP/07/I/2026,05/01/2026,05/01/2026 9:25:17,1,Koperasi Karyawan Umpu Taka,Pembayaran Pengangkutan CPO dari PKS Long Pinang  ke Pelabuhan Umum Pondong 15-19 Desember 2025,66.326.282,05/01/2026 17:15:19,Yuni,05/01/2026 17:15:24,,,06/01/2026 10:17:04,,Selesai Dibayar,,0015_2026,07/01/2026,Teknik dan Pengolahan,,,,,,,4100273929,,,,,,,,
,0016,a. Januari,2026,50. ANGKUTAN TBS DAN KARET,5TEP/SPP/08/I/2026,05/01/2026,05/01/2026 9:30:57,2,Koperasi Karyawan Umpu Taka,Pembayaran Pengangkutan CPO dari PKS Long Pinang  ke Pelabuhan Umum Pondong periode 20-23 Desember 2025 sesuai No. Addendum 5TEP/ADD/43/V/2025 tgl. 30 Mei 2025,207.100.000,05/01/2026 16:40:22,Yuni,05/01/2026 16:40:27,,,06/01/2026 10:17:09,,Selesai Dibayar,,0016_2026,07/01/2026,Teknik dan Pengolahan,,,,,,,4100273929,,,,,,,,
,0017,a. Januari,2026,,5PTI/SPP/1/I/2026,05/01/2026,05/01/2026 9:58:53,1,PT Pelindo,Pembayaran atas Jasa Pelabuhan Pelindo Trisakti Banjarmasin sesuai Sales Order No. 1360023640 tgl. 8 Desember 2025 Kontrak No. 1134/PALMCO/CPO-L/N-IV/XI/2025 dengan Total Volume sebanyak 2.000 Ton,95.275.750,05/01/2026 16:40:22,Yuni,05/01/2026 16:40:27,,,,Lagi diajukan PPAB,Selesai Dibayar,,0017_2026,12/01/2026,Pengadaan & TI,,,,,,,,,,,,,,,
,0018,a. Januari,2026,50. Pembelian TBS KALBAR & P3BB,5DPM/5AKN/SPP/5/I/2026,05/01/2026,05/01/2026 14:57:41,1,Pemasok TBS di PKS Gunung Meliau,Permintaan pembayaran Pembelian TBS Plasma/Pekebun Swadaya P.III PKS Gunung Meliau periode tgl. 1 s.d. 4 Januari 2025,1.039.538.838,05/01/2026 15:10:57,Yuni,05/01/2026 15:12:23,,,05/01/2026 17:12:23,,Selesai Dibayar,,0018_2026,06/01/2026,Distrik Petani Mitra,,,,,,,,,,,,,,,
,0019,a. Januari,2026,50. Pembelian TBS KALBAR & P3BB,5DPM/5AKN/SPP/6/I/2026,05/01/2026,05/01/2026 14:57:42,1,Pemasok TBS di PKS Rimba Belian,Permintaan pembayaran Pembelian TBS Plasma/Pekebun Swadaya P.III PKS Rimba Belian periode tgl. 1 s.d. 4 Januari 2026,645.012.427,05/01/2026 15:11:00,Yuni,05/01/2026 15:12:23,,,05/01/2026 17:12:23,,Selesai Dibayar,,0019_2026,06/01/2026,Distrik Petani Mitra,,,,,,,,,,,,,,,
,0020,a. Januari,2026,50. Pembelian TBS KALBAR & P3BB,5DPM/5AKN/SPP/7/I/2026,05/01/2026,05/01/2026 14:57:43,1,Pemasok TBS di PKS Parindu,Permintaan pembayaran Pembelian TBS di PKS Parindu periode tgl. 1 s.d. 4 Januari 2026,829.408.282,05/01/2026 15:11:02,Yuni,05/01/2026 15:12:20,,,05/01/2026 17:12:23,,Selesai Dibayar,,0020_2026,06/01/2026,Distrik Petani Mitra,,,,,,,,,,,,,,,
,0021,a. Januari,2026,50. Pembelian TBS KALBAR & P3BB,5DPM/5AKN/SPP/8/I/2026,05/01/2026,05/01/2026 14:57:44,1,Pemasok TBS di PKS Ngabang,Permintaan pembayaran Pembelian TBS Pekebun Swadaya/Pihak III PKS Ngabang periode tgl. 1 s.d. 4 Januari 2026,363.104.962,05/01/2026 15:11:05,Yuni,05/01/2026 15:12:25,,,05/01/2026 17:12:23,,Selesai Dibayar,,0021_2026,06/01/2026,Distrik Petani Mitra,,,,,,,,,,,,,,,
,0022,a. Januari,2026,50. Pembelian TBS KALBAR & P3BB,5DPM/5AKN/SPP/9/I/2026,05/01/2026,05/01/2026 14:57:44,1,Pemasok TBS di PKS Kembayan,Permintaan pembayaran Pembelian TBS Plasma/Pekebun Swadaya P.III PKS Kembayan periode tgl. 1 s.d. 4 Januari 2026,177.932.853,05/01/2026 15:11:09,Yuni,05/01/2026 15:12:28,,,05/01/2026 17:12:23,,Selesai Dibayar,,0022_2026,06/01/2026,Distrik Petani Mitra,,,,,,,,,,,,,,,
,0023,a. Januari,2026,50. Pembelian TBS KALTIM,5DPM/5AKN/SPP/10/I/2026,05/01/2026,05/01/2026 14:57:45,1,Pemasok di PKS Long Pinang,Permintaan pembayaran TBS di PKS Long Pinang periode tgl. 1 s.d. 4 Januari 2026,534.479.652,05/01/2026 15:11:12,Yuni,05/01/2026 15:12:30,,,05/01/2026 17:12:23,,Selesai Dibayar,,0023_2026,06/01/2026,Distrik Petani Mitra,,,,,,,,,,,,,,,
,0024,a. Januari,2026,50. ANGKUTAN TBS DAN KARET,5TEP/SPP/01/I/2026,05/01/2026,05/01/2026 15:55:27,1,CV Koni Sejahtera,Permintaan pembayaran Pekerjaan Angkutan TBS Kebun Gunung Meliau bulan Desember 2025 sesuai Surat Perjanjjian No. 5TAN/SPK/46/5KGM/IV/2025 tgl. 8 April 2025,368.335.517,05/01/2026 16:44:50,Yuni,05/01/2026 16:44:54,,,06/01/2026 9:52:12,,Selesai Dibayar,,0024_2026,07/01/2026,Tanaman,,,,,,,4300068433,,,,,,,,
,0025,a. Januari,2026,50. ANGKUTAN TBS DAN KARET,5TEP/SPP/02/I/2026,05/01/2026,05/01/2026 16:00:19,1,CV Koni Sejahtera,Permintaan pembayaran Pekerjaan Angkutan Tankos Kebun Gunung Meliau bulan Desember 2025 sesuai Surat Perjanjjian No. 5TAN/SPK/76/5KGM/VI/2025 tgl. 4 Juni 2025,64.917.188,05/01/2026 16:45:02,Yuni,05/01/2026 16:45:06,,,06/01/2026 9:51:46,,Selesai Dibayar,,0025_2026,07/01/2026,Teknik dan Pengolahan,,,,,,,4300071781,,,,,,,,
,0026,a. Januari,2026,50. PENGOSONGAN RUMAH,5SDM/SPP/02/I/2026,05/01/2026,05/01/2026 16:03:53,1,Kebun Batulicin GL. 51101068,Pembayaran Pengosongan Rumah Dinas Karyawan menjalani MBT/meninggal dunia a.n. Anwar Gol. IB/8,11.574.510,05/01/2026 16:59:18,Yuni,05/01/2026 16:59:29,,,06/01/2026 10:18:08,,Selesai Verifikasi,,0026_2026,,SDM & Sistem Manajemen,,,,,,,,,,,,,,,
,0027,a. Januari,2026,,5SDM/SPP/01/I/2026,05/01/2026,05/01/2026 16:06:35,1,Terlampir,"Pengumandahan Karyawan Kebun Pamukan ke PKS Ngabang dari tanggal 26 Nopember 2025 s.d. 31 Desember 2025 sebanyak 16 orang (Perhitungan Terlampr). Periode I (26 Nopember s.d. 16 Desember 2025) dibayar 100%, Periode II (17 Desember 2025 s.d. 31 Desember 2025) dibayar 50%",28.035.000,05/01/2026 16:59:21,Yuni,05/01/2026 16:59:32,,,06/01/2026 10:18:10,,Selesai Dibayar,,0027_2026,08/01/2026,SDM & Sistem Manajemen,,,,,,,,,,,,,,,
,0028,a. Januari,2026,50. PENGOSONGAN RUMAH,5SDM/SPP/03/I/2026,05/01/2026,05/01/2026 16:10:39,1,Kebun Batulicin GL. 51101068,Pembayaran Pengosongan Rumah Dinas Karyawan menjalani MBT/meninggal dunia a.n. Sonetra Gol. IB/9,11.579.229,05/01/2026 16:58:38,Yuni,05/01/2026 16:58:46,,,,,Proses Verifikasi,,0028_2026,,SDM & Sistem Manajemen,,,,,,,,,,,,,,,
,0029,a. Januari,2026,,5SDM/SPP/04/I/2026,05/01/2026,05/01/2026 16:12:03,4,Kepala Bagian SDM & Sistem Manajemen Donny Usman,"Pembayaran biaya Honor Instruktur Senam Pagi Karyawan Kantor PTPN IV Regional V untuk hari Jumat, 9 Januari 2026",500.000,05/01/2026 16:58:54,Yuni,05/01/2026 16:58:58,,,,,Proses Verifikasi,,0029_2026,,SDM & Sistem Manajemen,,,,,,,,,,,,,,,
,0030,a. Januari,2026,50. Sewa Genset,5TEP/SPP/11/I/2026,05/01/2026,06/01/2026 8:35:08,1,Koperasi Jasa Palm Taka Berkah,Pembayaran Rampung atas Sewa Mesin Genset Dong Feng 30 HP di Afdeling I Kebun Pandawa Kalimantan Timur SPK No. 5KPD/5TEP/SPK/01/XII/2025,3.522.682,06/01/2026 16:41:22,Yuni,06/01/2026 16:41:26,,,13/01/2026 9:37:22,,Selesai Dibayar,,0030_2026,21/12/2025,Teknik dan Pengolahan,,5KPD/5TEP/SPK/01/XII/2025,01/12/2025,31/12/2025,5KPD/5TEP/BAST/51/XII/2025,31/12/2025,4703949964,,,,,,,,
,0031,a. Januari,2026,50. CAPEX JALAN & JEMBATAN,5TEP/SPP/12/I/2026,05/01/2026,06/01/2026 8:38:17,1,CV Anugerah Jaya Cemerlang,Pembayaran Retensi atas Pembuatan 1 unit Jembatan Kayu Ukuran 4M x 4M X 3M di Afdeling III Kebun Rimba Belian Kalbar SPK No. 5TEP-AB/SP/117/VIII/2025,6.189.245,06/01/2026 16:37:55,Yuni,06/01/2026 16:38:05,,,06/01/2026 17:56:17,,Selesai Dibayar,,0031_2026,14/01/2026,Teknik dan Pengolahan,,5TEP-AB/SP/117/VIII/2025,05/08/2025,03/11/2025,RIMBA/BAPUJP/26/XII/2025,18/12/2025,4300074231,,,,,,,,
,0032,a. Januari,2026,,5TEP/SPP/09/I/2026,05/01/2026,06/01/2026 8:39:59,1,CV Gajah Mas Perkasa,Pembayaran rampung atas Pengadaan Gorong-Gorong HDPE Kebun Ngabang Kalbar Kontrak No. 5TEP-AB/SP/180/XI//2025,610.355.700,06/01/2026 16:43:08,Yuni,06/01/2026 16:43:12,,,13/01/2026 9:38:57,,Selesai Dibayar,,0032_2026,14/01/2026,Teknik dan Pengolahan,, 5TEP-AB/SP/180/XI/XI/2025,17/11/2025,17/12/2025,5KNG/BA/07/GMP/XI/2025,17/11/2025,4300079226,,,,,,,,
,0033,a. Januari,2026,50. BARANG DAN JASA KEBUN UNIT,5TEP/SPP/13/I/2026,05/01/2026,06/01/2026 9:22:11,1,CV Ratu Mekar Widjaya,Pembayaran atas Pembelian Barang dan Jasa sesuai OPL/SPK/SPJB No. 5TEP/SPJ/18/X/2025 tgl. 28 Oktober 2025,211.771.350,06/01/2026 15:06:01,Yuni,06/01/2026 15:06:08,,,13/01/2026 9:37:32,,Selesai Dibayar,,0033_2026,14/01/2026,Teknik dan Pengolahan,, 5TEP/SPJ/18/X/2025,28/10/2025,27/11/2025,5PLP/BAPBM/061/XI/2025,27/11/2025,4300078932,,,,,,,,
,0034,a. Januari,2026,50. BARANG DAN JASA KEBUN UNIT,5TEP/SPP/10/I/2026,05/01/2026,06/01/2026 9:22:13,1,PT Industri Karet Nusantara,Pembayaran Pembelian Barang dan Jasa sesuai OPL/SPK/SPJB No. SP/Palm/R5/2025/0057 tgl. 28 Juli 2025 PKS Long Pinang,29.021.616,06/01/2026 15:06:23,Yuni,06/01/2026 15:06:11,,,08/01/2026 17:48:49,,Selesai Dibayar,,0034_2026,14/01/2026,Teknik dan Pengolahan,,SP/Palm/R5/2025/0057,28/07/2025,,033/BAPBM/Pagun/VIII/2025,14/08/2025,4300073782,,,,,,,,
,0035,a. Januari,2026,,5SKH/SPP/02/UMUM/I/2026,05/01/2026,06/01/2026 10:22:45,1,Ferryanto Situmorang Bendahara Umum SPBUN PTPN XIII Tk Perusahaan,Pembayaran Dukungan Pelaksanaan Kegiatan Perundingan PKB sesuai Surat No. SP-BUN/001/I/2026 tgl. 2 Januari 2026,25.000.000,06/01/2026 15:06:23,Yuni,06/01/2026 15:06:11,,,06/01/2026 16:41:11,,Selesai Verifikasi,,0035_2026,,Sekretariat & Hukum,,,,,,,,,,,,,,,
,0036,a. Januari,2026,,5SDM/SPP/05/I/2025,05/01/2026,06/01/2026 10:41:21,1,Kepala Bagian SDM & Sistem Manajemen Donny Usman,Pembayaran biaya Pengobatan Region Head PT Perkebunan Nusantara IV Regional V a.n. Sudarma Bhakti Lessan dengan rincian sebagai berikut Apotik Best No. 02/RS/00057/01/26,324.000,06/01/2026 14:11:27,Yuni,06/01/2026 14:11:35,,,06/01/2026 16:41:11,,Selesai Verifikasi,,0036_2026,,SDM & Sistem Manajemen,,,,,,,,,,,,,,,
,0037,a. Januari,2026,,5SDM/SPP/07/I/2025,06/01/2026,06/01/2026 10:39:54,1,Kebun Tajati,Pembayaran Kekurangan Lembur Karyawan Meninggal Dunia a.n. Basrin,580.476,06/01/2026 14:12:20,Yuni,06/01/2026 14:12:24,,,06/01/2026 16:41:16,,Selesai Verifikasi,,0037_2026,,SDM & Sistem Manajemen,,,,,,,,,,,,,,,
,0038,a. Januari,2026,,5SDM/SPP/08/I/2025,06/01/2026,06/01/2026 10:29:52,1,Sesuai Lampiran,Pembayaran Hak Karyawan Berhenti Karena Program Pensiun Dipercepat (PPD) sesuai Berita Acara Hasil Seleksi Pengajuan Program Pensiun Dipercepat (PPD) Tahap IV PTPN IV Regional V tanggal 01 Januari 2026 untuk ditransfer sesuai nama-nama sebanyak 14 orang,1.313.172.966,06/01/2026 14:11:01,Yuni,06/01/2026 14:11:09,,,06/01/2026 16:41:24,potongan sewa rumah blm kepotong,Selesai Dibayar,,0038_2026,14/01/2026,SDM & Sistem Manajemen,,,,,,,,,,,,,,,
,0039,a. Januari,2026,50. Pembelian TBS KALBAR & P3BB,5DPM/5AKN/SPP/11/I/2026,06/01/2026,06/01/2026 14:19:26,1,Pemasok TBS di PKS Gunung Meliau,Permintaan pembayaran Pembelian TBS Plasma/Pekebun Swadaya P.III PKS Gunung Meliau periode tgl. 5 Januari 2026,650.883.113,06/01/2026 14:19:03,Yuni,06/01/2026 14:19:09,,,06/01/2026 16:41:24,,Selesai Dibayar,,0039_2026,06/01/2026,Distrik Petani Mitra,,,,,,,,,,,,,,,
,0040,a. Januari,2026,50. Pembelian TBS KALBAR & P3BB,5DPM/5AKN/SPP/12/I/2026,06/01/2026,06/01/2026 15:09:37,1,Pemasok TBS di PKS Rimba Belian,Permintaan pembayaran pembelian TBS Plasma/Pekebun Swadaya P.III PKS Rimba Belian periode tgl. 5 Januari 2026,476.113.732,06/01/2026 14:18:39,Yuni,06/01/2026 14:18:49,,,06/01/2026 16:41:24,,Selesai Dibayar,,0040_2026,06/01/2026,Distrik Petani Mitra,,,,,,,,,,,,,,,
,0041,a. Januari,2026,50. Pembelian TBS KALBAR & P3BB,5DPM/5AKN/SPP/13/I/2026,06/01/2026,06/01/2026 15:09:33,1,Pemasok TBS di PKS Parindu,Permintaan pembayaran Pembelian TBS di PKS Parindu periode tgl. 5 Januari 2026,778.288.401,06/01/2026 14:18:39,Yuni,06/01/2026 14:18:49,,,06/01/2026 16:41:24,,Selesai Dibayar,,0041_2026,06/01/2026,Distrik Petani Mitra,,,,,,,,,,,,,,,
,0042,a. Januari,2026,50. Pembelian TBS KALBAR & P3BB,5DPM/5AKN/SPP/14/I/2026,06/01/2026,06/01/2026 14:20:21,1,Pemasok TBS di PKS Ngabang,Permintaan pembayaran Pembelian TBS Pekebun Swadaya/Pihak III PKS Ngabang periode tgl. 5 Januari 2026,302.332.275,06/01/2026 14:18:39,Yuni,06/01/2026 14:18:49,,,06/01/2026 16:41:24,,Selesai Dibayar,,0042_2026,06/01/2026,Distrik Petani Mitra,,,,,,,,,,,,,,,
,0043,a. Januari,2026,50. Pembelian TBS KALBAR & P3BB,5DPM/5AKN/SPP/15/I/2026,06/01/2026,06/01/2026 15:09:30,1,Pemasok TBS di PKS Kembayan,Permintaan pembayaran Pembelian TBS Plasma/Pekebun Swadaya P.III PKS Kembayan periode tgl. 5 Januari 2026,712.128.816,06/01/2026 14:18:39,Yuni,06/01/2026 14:18:49,,,06/01/2026 16:41:24,,Selesai Dibayar,,0043_2026,06/01/2026,Distrik Petani Mitra,,,,,,,,,,,,,,,
,0044,a. Januari,2026,50. Pembelian TBS KALTIM,5DPM/5AKN/SPP/16/I/2026,06/01/2026,06/01/2026 11:23:39,1,Pemasok TBS di PKS Long Pinang,Permintaan pembayaran TBS di PKS Long Pinang periode tgl. 5 Januari 2026,322.099.134,06/01/2026 14:05:03,Yuni,06/01/2026 14:05:13,,,06/01/2026 16:41:24,,Selesai Dibayar,,0044_2026,06/01/2026,Distrik Petani Mitra,,,,,,,,,,,,,,,
,0045,a. Januari,2026,50. Pembelian TBS KALSEL,5DPM/5AKN/SPP/17/I/2026,06/01/2026,06/01/2026 11:23:42,1,Pemasok TBS di PKS Pelaihari,Permintaan pembayaran TBS Pemasok di PKS Pelaihari periode tgl. 5 Januari 2026,147.034.692,06/01/2026 14:04:23,Yuni,06/01/2026 14:04:33,,,06/01/2026 16:41:24,,Selesai Dibayar,,0045_2026,06/01/2026,Distrik Petani Mitra,,,,,,,,,,,,,,,
,0046,a. Januari,2026,,5TEP/SPP/16/I/2026,05/01/2026,06/01/2026 16:01:20,1,CV Gajah Mas Perkasa,Pembayaran Rampung atas Pengadaan Gorong-Gorong uk. 60 cm dan 80 cm Kebun Kembayan Kalimantan Barat sesuai No. SPK Kontrak 5KBY/SPK-TEK/GMP/06/XI/2025,48.396.000,07/01/2026 9:13:40,Yuni,07/01/2026 9:13:45,,,13/01/2026 9:38:14,,Selesai Dibayar,,0046_2026,14/01/2026,Teknik dan Pengolahan,,5KBY/SPK-TEK/GMP/06/XI/2025,15/11/2025,15/12/2025,5E09/BAPBM/2025/170/XII/2025,15/12/2025,4704033332,,,,,,,,
,0047,a. Januari,2026,,5TEP/SPP/14/I/2026,05/01/2026,06/01/2026 16:04:59,1,CV Gajah Mas Perkasa,Pembayaran rampung atas Pengadaan Sparepart  Perbaikan Alat Berat Vibro Compactor Kebun Kembayan Kalimantan Barat sesuai No. SPK Kontrak 5KBY/SPK-TEK/GMP/05/XI/2025,18.691.290,07/01/2026 9:14:31,Yuni,07/01/2026 9:14:24,,,08/01/2026 17:49:41,,Selesai Dibayar,,0047_2026,14/01/2026,Teknik dan Pengolahan,,5KBY/SPK-TEK/GMP/05/XI/2025,26/11/2025,25/12/2025,5E09/BAPBM/2025/171/XII/2025,29/11/2025,4100300488,,,,,,,,
,0048,a. Januari,2026,,5TEP/SPP/19/I/2026,05/01/2026,06/01/2026 16:09:12,1,Koperasi Jasa Palm Taka Berkah,"Pembayaran rampung atas Jasa Rehab Rumah Karyawan Pelaksana 10 Pintu di Afd. I, II, dan III Kebun Pandawa Kalimantan Timur sesuai No. SPK Kontrak 5KPD/SPKL/03/X/2025",43.600.000,07/01/2026 9:14:31,Yuni,07/01/2026 9:14:24,,,08/01/2026 17:49:20,,Selesai Dibayar,,0048_2026,14/01/2026,Teknik dan Pengolahan,,5KPD/SPKL/03/X/2025,11/10/2025,25/11/2025,5KPD/BAST/03/XI/03/2025,25/11/2025,4704042094,,,,,,,,
,0049,a. Januari,2026,50. Sewa Alat Berat,5TEP/SPP/15/I/2026,05/01/2026,06/01/2026 16:16:22,1,Koperasi Jasa Palm Taka Berkah,"Pembayaran rampung atas Sewa 300 HM Greader dan 200 HM Vibro Roller untuk Perbaikan Jalan Penghubung, Produksi & Koleksi di Afdeling II dan Afdeling IV Kebun Tajati Kaltim SPK No. 5TEP-AB/SP/144/IX/2025",402.859.375,07/01/2026 10:48:45,Yuni,07/01/2026 10:48:50,,,08/01/2026 17:49:11,,Selesai Dibayar,,0049_2026,14/01/2026,Teknik dan Pengolahan,,5TEP-AB/SP/144/IX/2025 ,17/09/2025,06/11/2025,5KTJ/BAST/140/XII/2025,20/12/2025,4300076211,,,,,,,,
,0050,a. Januari,2026,50. CAPEX BANGUNAN RUMAH & PERUSAHAAN,5TEP/SPP/18/I/2026,05/01/2026,06/01/2026 16:16:48,1,CV Anugerah Jaya Cemerlang,Pembayaran rampung atas Pembangunan 2 unit Rumah G5 Permanen Afdeling III Kebun Tajati Kaltim SPK No. 5TEP-AB/SP/119/VIII/2025,933.966.021,07/01/2026 10:48:45,Yuni,07/01/2026 10:48:50,07/01/2026 10:45:26,12/01/2026 11:09:30,15/01/2026 9:59:12,"mir 7 selisih 1, sudah diperabiki 12/01/26",Selesai Verifikasi,,0050_2026,,Teknik dan Pengolahan,,5TEP-AB/SP/119/VIII/2025,07/08/2025,05/12/2025,5KTJ/BAST/119/XII/2025,04/12/2025,4300074270,,,,,,,,
,0051,a. Januari,2026,,5TEP/SPP/17/I/2026,05/01/2026,06/01/2026 16:16:51,1,CV Anugerah Jaya Cemerlang,Pembayaran rampung atas Pembuatan 1 unit Tower Air dengan Sumur Bor di Afdeling III Kebun Tajati Kaltim SPK No. 5TEP-AB/SP/204/XII/2025,101.432.432,07/01/2026 10:42:38,Yuni,07/01/2026 10:42:43,,,15/01/2026 9:59:10,,Selesai Dibayar,,0051_2026,21/12/2025,Teknik dan Pengolahan,, 5TEP-AB/SP/204/XII/2025,24/11/2025,22/12/2025,5KTJ/BAST/204/XII/2025,20/12/2025,43000803306,,,,,,,,
,0052,a. Januari,2026,,5SDM/SPP/06/I/2026,06/01/2026,06/01/2026 16:21:25,1,Sdr. Nikolaus Niko GL. 51100458,"Pembayaran biaya Pindah Sdr. Nikolaus Niko K/3 Gol. IIIB/2 dari Kebun Tajati ke PKS Samuntai, Regional V sesuai Surat No. 5KTJ/5SDM/eM-1/I/2026 tanggal 5 Januari 2026",2.351.500,06/01/2026 17:40:04,Yuni,06/01/2026 17:40:12,,,06/01/2026 17:56:39,,Selesai Dibayar,,0052_2026,14/01/2026,SDM & Sistem Manajemen,,,,,,,,,,,,,,,
,0053,a. Januari,2026,,5SDM/SPP/09/I/2026,06/01/2026,06/01/2026 16:23:54,1,Kebun Gunung Emas,Pembayaran Extra Fooding Kebun Gunung Emas bulan Desember 2025,406.000,06/01/2026 17:41:22,Yuni,06/01/2026 17:41:29,,,06/01/2026 17:56:43,,Selesai Dibayar,,0053_2026,14/01/2026,SDM & Sistem Manajemen,,,,,,,,,,,,,,,
,0054,a. Januari,2026,,5SDM/SPP/10/I/2026,06/01/2026,06/01/2026 16:25:25,1,Kepala Bagian SDM & Sistem Manajemen Donny Usman,Pembayaran biaya Pengobatan Region Head PT Perkebunan Nusantara IV Regional V a.n. Sudarma Bhakti Lessan dengan rincian sebagai berikut Apotik Best No. 01/RS/01163/0126,470.000,06/01/2026 17:41:40,Yuni,06/01/2026 17:41:45,,,06/01/2026 17:56:47,,Selesai Verifikasi,,0054_2026,,SDM & Sistem Manajemen,,,,,,,,,,,,,,,
,0055,a. Januari,2026,,5SKH/SPP/17/UMUM/I/2026,06/01/2026,06/01/2026 16:36:49,1,Sumedi Joko Purwanto (Kabid. Tanaman Plasma/KKPA),Penggantian biaya Pembelian Tinta Printer & Biaya Rupa-Rupa Distrik Petani Mitra sesuai Memorandum No. 5DPM/5SKH/M-273/XII/2025 tgl. 24 Desember 2025,1.189.000,07/01/2026 9:44:40,Yuni,07/01/2026 9:44:45,,,20/01/2026 8:14:24,,Selesai Verifikasi,,0055_2026,,Sekretariat & Hukum,,,,,,,,,,,,,,,
,0056,a. Januari,2026,,5SKH/SPP/16/UMUM/I/2026,06/01/2026,06/01/2026 16:39:15,1,Sumedi Joko Purwanto (Kabid. Tanaman Plasma/KKPA),Pembayaran Uang Muka biaya Alat Tulis Kantor (ATK) Triwulan I Tahun 2026 sesuai Memorandum No. 5DPM/5SKH/M-275/XII/2025 tgl. 29 Desember 2025,5.000.000,07/01/2026 10:06:07,Yuni,07/01/2026 10:06:13,,,,,Proses Verifikasi,,0056_2026,,Sekretariat & Hukum,,,,,,,,,,,,,,,
,0057,a. Januari,2026,,5SKH/SPP/15/UMUM/I/2026,06/01/2026,06/01/2026 16:40:55,1,Agus Rinaldi (Kabag. Tekpol),Penggantian biaya Lain-Lain sesuai Memorandum No. 5TEP/5SKH/M-325/XII/2025 tgl. 24 Desember 2025,1.723.190,07/01/2026 9:59:16,Yuni,07/01/2026 9:59:23,,,15/01/2026 14:45:38,,Selesai Verifikasi,,0057_2026,,Sekretariat & Hukum,,,,,,,,,,,,,,,
,0058,a. Januari,2026,,5SKH/SPP/14/UMUM/I/2026,06/01/2026,06/01/2026 16:43:14,1,Agus Rinaldi (Kabag. Tekpol),Pembayaran Uang Muka biaya Alat Tulis Kantor (ATK) Triwulan I Tahun 2026 sesuai Memorandum No. 5TEP/5SKH/M-328/XII/2025 tgl. 24 Desember 2025,6.750.000,07/01/2026 10:00:12,Yuni,07/01/2026 10:00:17,,,,,Proses Verifikasi,,0058_2026,,Sekretariat & Hukum,,,,,,,,,,,,,,,
,0059,a. Januari,2026,,5SKH/SPP/13/UMUM/I/2026,06/01/2026,06/01/2026 16:45:06,1,Agus Rinaldi (Kabag. Tekpol),Penggantian biaya Rupa-Rupa sesuai Memorandum No. 5TEP/5SKH/M-01/I/2026 tgl. 2 Desember 2025,4.997.100,07/01/2026 9:57:25,Yuni,07/01/2026 9:57:30,,,,,Proses Verifikasi,,0059_2026,,Sekretariat & Hukum,,,,,,,,,,,,,,,
,0060,a. Januari,2026,,5SKH/SPP/12/UMUM/I/2026,06/01/2026,06/01/2026 16:46:59,1,Harry Sutriadi (Kabag. Tanaman),Penggantian biaya Rupa-Rupa sesuai Memorandum No. 5TAN/5SKH/M-382/XII/2025 tgl. 23 Desember 2025,4.094.882,07/01/2026 9:54:30,Yuni,07/01/2026 9:54:37,,,14/01/2026 14:42:42,,Selesai Verifikasi,,0060_2026,,Sekretariat & Hukum,,,,,,,,,,,,,,,
,0061,a. Januari,2026,,5SKH/SPP/11/UMUM/I/2026,06/01/2026,06/01/2026 16:48:53,1,Herry Wahyudi (Kabag. Akuntansi & Keuangan),"Penggantian biaya Transportasi & Konsumsi KAP Purwanto, Susanti & Surja sesuai Memorandum No. 5AKN/5SKH/M-569/XII/2025 tgl. 29 Desember 2025",4.955.085,07/01/2026 9:54:30,Yuni,07/01/2026 9:54:37,,,,,Proses Verifikasi,,0061_2026,,Sekretariat & Hukum,,,,,,,,,,,,,,,
